cleanText,new_labels_1
our health department our city and our county declared racism as a public health crisis last year,1
significantly more people died of covid19 in two months than died of overdoses all of last year or the year before,1
in covid19 crisis only 20 of african americans had jobs where they could work from home,1
infection rates in allegany cattaraugus and chautauqua counties have consistently been among the lowest in the state,1
since the week ending march 14 wisconsin actually saw a drop in tourism spending compared to last year of 17 billion,1
if roe is overturned wisconsin has a law on the books that would immediately make abortion a crime,1
today the gap between african american and white homeownership is larger than it was in the late 1960s,1
research illustrates a clear correlation between vitamin d deficiencies and higher covid19 mortality rates,1
twothirds of americans disapprove of donald trump not wearing a face mask in public,1
says gloves shouldnt be worn in public because if you are wearing the same set of gloves all over town you are only spreading germs everywhere you go,1
new york is one of only 12 states where the average gallon of gas costs more than 200,1
says its illegal to hold an absenteeonly election or mail ballots to every registered voter,1
small trials to test convalescent plasma therapy for coronavirus patients seem to have had some degree of success,1
says texas either is near the bottom or at the very bottom when it comes to testing per capita,1
north carolina is in the small minority of states that requires an absentee ballot to be signed by two witnesses or a notary public,1
virginia has lagged behind other states when it comes to covid19 testing,1
until this week they osha werent even enforcing these guidelines for coronavirus still today osha is not specifying which rules employees must follow or how to keep their workers safe and healthy,1
the poor are ironically the most likely to be employed in the industries deemed essential while their upperclass peers are freed to bunker down for weeks until the first death wave passes,1
go look at other countries that went through exactly this started to reopen and then they saw the infection rate go back up again,1
africans living in china now being forced to sleep outside in the cold as chinese nationals blame them for the rising number of new coronavirus cases in the country,1
republicans have shown themselves willing to cut millions off their health insurance and eliminate preexisting condition protections for millions more even in the middle of this public health crisis,1
before covid19 iowa had one of the lowest unemployment rates in the country and many employers were scrambling to find qualified employees to fill their job openings,1
says of the coronavirus threat there was not a single suggestion by anyone a doctor a scientist a political figure that we needed to cancel mardi gras,1
photo shows a crowded new york city subway train during stayathome order,1
on february 7 the who warned about the limited stock of ppe that same day the trump administration announced it was sending 18 tons of masks gowns and respirators to china,1
my mask will keep someone else safe and their mask will keep me safe,1
says longstanding food and drug administration regulations created barriers to the private industry creating a test quickly for the coronavirus,1
no city in the state can quarantine itself without state approval,1
says most nc legislators are in the high risk age group for coronavirus,1
says spectrum will provide free internet to students during coronavirus school closures,1
some states are only getting 50 tests per day and the utah jazz got 58,1
whole of italy goes into quarantine,1
the average wisconsin residents tax burden is at its lowest level in nearly 50 years while incomes continue to grow,1
youve raised a lot more money than i have bernie,1
during his tenure as mayor of new york city street homelessness decreased by 28 percent,1
berniesanders receives strong support from the conservative most rural part of vermont,1
the majority of hunters now want universal background checks the majority of trump voters,1
from the moment we passed that signature legislation mike bloomberg called it a disgrace,1
says since he took office the city of milwaukee has seen the creation of 7000 new affordable housing units,1
over 50 of the people now in the house and state senate have not been born in virginia,1
national polls have never predicted who will be president from our party carter was in the single digits a few months before caucuses bill clinton was obama 20 points behind in the national polls roughly,1
traditionally the speaker says members of congress i have the high privilege and distinct honor of presenting to you the president of the united states tonight speaker pelosi said members of congress the president of the united states,1
says 10 of u s children are texans,1
the president of the united states already has the legal authority to reduce the price of many commonly used prescription drugs,1
more than 80 of republicans think we ought to at least be doing universal background checks,1
the american people are overwhelmingly with us in calling witnesses in senate trial,1
mayor bloomberg helped lower the number of uninsured by 40 percent covering 700000 more new yorkers,1
twitter is banned in iran,1
witnesses have been part of every other impeachment trial the senate has ever had,1
we have the lowest corporate tax rate since 1968,1
florida is the 45th in state education funding,1
in 1988 in response to irans attack on the u s s samuel roberts president ronald reagan destroyed half of irans navy,1
we end the 100 billion a year that the health care industry makes,1
look at the men on this stage collectively they have lost 10 elections the only people on this stage who have won every single election that theyve been in are the women amy and me,1
a man at the storming of the u s embassy in iraq visited the white house in 2011,1
the united states is the only nation that grants legal permanent residency to more than a million people per year,1
last year 36 million americans didnt have a prescription filled because they couldnt afford it,1
if youre a black woman youre 320 more likely to die from complications in childbirth,1
says pete buttigieg ran statewide in indiana and lost by 20 points,1
real wages went up last year 11,1
california firefighters decided to speak out against president trump because his tweet about the states wildfires contained so much misinformation,1
says a new annual report shows that west virginias tourism industry has grown for the second consecutive year reversing years of decline and outpacing national growth by 58 percent,1
a study showed as many as one in four people have had a package stolen from their residence,1
says the cartels are so bad in a mexican border state that the u s government issued a do not travel warning the same warning it issued for syria,1
i am the only member of congress that voted for both inquiries the clinton inquiry and now the trump inquiry,1
if we make no changes over the next 10 years americans will reach into their pockets and pay out about 11 trillion on insurance premiums copays deductibles and uncovered medical expenses,1
on average one person dies by suicide every 22 hours in west virginia,1
90000 californians are unsheltered and homeless,1
the impeachment inquiry hearings going on behind closed doors over which congressman schiff is presidingthey are consistent with the rules of the u s house of representatives,1
president trump has sent 14000 american troops to the middle east region since may so he cant tell his political rallies that hes getting troops out of endless wars when hes sending 14 times the amount back into the region,1
americans say that what they want is a choice to join a singlepayer system like medicare rather than ending private insurance,1
west virginia department of education reported over 10000 children and youth have been identified as homeless for the 20182019 school year,1
millionaires are eligible for food stamps but donald trump came along and decided to put a stop to it,1
about 95 percent of americas production of ethylene is produced on the gulf coast in texas and louisiana,1
meth production in mo has cratered over last decade mo hwy patrol reported 1326 meth lab seizures in 2006 only 50 in 2018,1
minneapolis city government preemptively informed the target center that it would be responsible for 530000 in security and other costs related to a trump rally more than 26 times the estimated security costs for a 2009 target center health care rally held by president barack obama,1
says in the 2016 presidential election i won that one by 42 points 42 points west virginia,1
more than half of death row prisoners are people of color,1
u s agricultural food exports are expected to increase more than 2 billion annually under usmca,1
says people convicted of felonies or under restraining orders can buy a firearm without going through a background check,1
one unnamed donor gave 17 million to the leoaffiliated judicial crisis network to block the nomination of judge merrick garland and to support gorsuch then a donor perhaps the same one gave another 17 million to prop up kavanaugh,1
thirtyfour of the 47 men depicted in the famous declaration of independence painting were slaveholders,1
there are 390 million guns out on the streets of a country of 329 million people,1
america has more governors whove worn blackface than black governors,1
the last time people created a hollywood blacklist people ended up killing themselves they were accused and they lost their right to work,1
floridas red flag gun law has been used about five times a day,1
the law says that mental health must be treated the same as physical health but coverage by health insurers is unequal,1
if you go back you can see wayne lapierre who runs the nra testifying in front of congress in favor of background checks 15 or 20 years ago,1
more americans are uninsured today than when president donald trump took office,1
says of el paso that some years in a city of almost 700000 we had five murders the entire year our average over the last 10 years is 18 murders per year we exceeded that average just on one day after a gunman opened fire at a walmart in the city,1
studies show at the minimum wage you cant rent a twobedroom apartment anywhere in the united states a modest twobedroom apartment,1
since 2014 there has been a 25 reduction in crime in communities at the texasmexico border,1
rep ilhan omar voted yes to provide further funding for the 911 first responders victims fund while sen rand paul voted no,1
triggering leftists trumps reelection campaign is selling plastic straws,1
food stamp participation hits 10 year low,1
in 2017 we had more marijuana possession arrests in our country than all other violent crimes combined,1
the wealthiest three families now own more wealth than the bottom half of the country,1
the typical black family in this country has onetenth the wealth of the typical white family,1
wisconsin is a top 10 state for health care coverage,1
in 2018 when he ran for senator young voter turnout in early voting was up 500 we won more votes than any democrat has in the history of the state of texas,1
the united states is the only industrialized country without universal healthcare,1
just the last three weeks on average about 23000 women children men are coming over across the border illegally as family units or as unaccompanied children,1
most research shows that uw salaries are a little behind and in some areas were behind more than others,1
the va negotiates prescription drug prices medicare doesnt do that,1
says immigrant military service members applying for u s citizenship are getting rejected at higher numbers than those who are not veterans,1
we saw the prison population expand and vacancy rates for correctional officers go from 29 to 152 over the last eight years,1
we beat the nra with tough tough gun laws in colorado,1
in fact high crimes and misdemeanors is not defined in the constitution and does not require corresponding statutory charges the context implies conduct that violates the public trustand that view is echoed by the framers of the constitution and early american scholars,1
i actually in 2005 ran on medicare for all,1
weve had a 30 increase in suicides in this country in just 15 years,1
suicide is the secondleading cause of death among 1519 year olds and 2534 year olds in missouri,1
texas actually leads in the number of confederate monuments removed,1
over 30 states passed the legislation to ban powdered alcohol and missouri is not one of them,1
im one of the first guys to introduce a climate change bill way way back in 87,1
994 of businesses in wisconsin are small businesses and they employ nearly half of our workforce,1
youve got millions of families paying 40 50 60 of their limited incomes to put a roof over their heads,1
the unemployment rate for wisconsin workers has reached historic lows its never been this low before ever ever ever,1
speaking of the financial crisis that gained traction in 2007 i talked about it to anyone who would listen a crisis is coming,1
the enumeration clause speaks to the count of every individual and not just americans not just citizens,1
all the ponds in missouri for which we have data are causing groundwater contamination this is a statewide issue,1
says 74 of people in texas are crammed into 4 of the land,1
big pharmaceuticals pay off they literally pay off generics to keep the prices and the competition off the market,1
says 5 out of 10 gop candidates dont live in north carolinas 9th congressional district,1
in my own state of vermont from the very first days of our states history what our constitution says is that everybody can vote that is true so people in jail can vote,1
i was the only member of the senate republican or democrat who has consistently voted against efforts to use the so called nuclear option to change the rules of the senate,1
west virginias exports increased for the second year in a row in 2018 reaching 81 billion additionally west virginias export growth rate was 142 nearly double the national average of 76,1
our state has fewer science technology engineering and math graduates than any neighboring state,1
since 2011 we have documentation of 1671 dead bodies we have recovered in texas many in brooks county,1
the 2008 election was the first election in which voters of color comprised over 25 percent of the electorate and that number is going up,1
currently 23 percent of our militarys infrastructure is graded as poor while 9 percent is failing,1
in new york state democrats blocked a bill expanding college tuition for gold star families after approving aid for illegal immigrants,1
there have been zero reported instances of any child born alive after an abortion in texas,1
the affordable care act provided over 200000 west virginians with health care coverage,1
wisconsin has the highest infant mortality rate for black babies nationwide,1
like every budget passed by the senate since i have been lieutenant governor senate bill 1 is within the spending limit set by the texas constitution,1
says all north carolina teachers do not currently get a duty free lunch break,1
missouri ranks 45th in the nation in per capita state fiscal support for higher education and missouri state is last among missouri schools,1
about 80 percent of the manufacturing and agriculture tax credit goes to claimants who are making 1 million or more,1
right now 1 in 4 texas women of reproductive age are uninsured totaling 15 million texas women,1
for cabinet posts i have the best voting record against trump nominees of anyone else running for president,1
says an ice detainer request is not a valid warrant,1
29 states still dont have comprehensive protections for people in the lgbtq community,1
says zero african americans have presented to the house budget committee in 2019,1
we are always going to need architects doctors were going to need professionals with fouryear degrees but 65 to 70 percent of the people in missouri dont have degrees,1
over the last eight years weve shown that even though weve cut taxes by 8 billion revenues continue to grow,1
california has the largest death row in the western hemisphere the largest death row in the united states of america two times the size of the next largest state florida,1
the boeing 737 max 8 the type of plane that crashed in ethiopia continues to fly in the united states despite the faa saying software updates are likely coming,1
since 2011 the gap in high school graduation rates between africanamerican students and all students has been cut in half from 64 percent to 31 percent,1
we maintain this missouri highway system with one of the lowest levels of funding in the country,1
virginia house republicans have had more africanamericans on key committees than when the democrats were in control,1
west virginia has the nations lowest workforce participation rate which hovers around 50 percent when the national average is about 63 percent,1
more than a million californians do not have clean water to bathe in or drink,1
todays minimum wage worker making 725 an hour has less buying power than a minimum wage worker in the 1960s,1
i have more military experience than anybody whos arrived behind that desk since george h w bush,1
on extremerisk guns laws this idea has passed republican legislatures in other states and has been signed by republican governors,1
a bill passed by gop legislators makes it harder to prosecute people and groups that violate campaign finance laws,1
the facts are the majority of opioids and all kinds of other things that are connected to the opioids are coming through the point of entry,1
new york has passed the best paid family leave program in the united states of america,1
the national defense authorization act for fiscal year 2019 includes the largest pay raise in nearly 10 years,1
adjusting for inflation west virginias median household income has not grown in a decade,1
the poverty rate in west virginia was 191 percent the fourthhighest in the country,1
there is nothing that we have done on amazon that we have not done with hundreds of other projects,1
in 2017 west virginias 43469 median household income was 16867 below the national average ranking 50th,1
says ann coulter said i am a settler i am descended from settlers not from immigrants,1
at general motors ceo mary barra took home almost 22 million dollars last year alone 295x your companys average employee,1
the united states spends more on potato chips than we do on all energy rd,1
missouri had the largest amount of millennial democrats running than any other state in the country,1
in fact 7 out of 10 new jobs in america are created by small businesses,1
middleclass income rose to a record level in 2017 as the strong economy lifted the fortunes of more americans,1
we have lost more lives in the last two years due to opioids than all of the lives lost during the vietnam war,1
says joe manchin refused to commit to kavanaugh until after the senate had the votes,1
trump supporters are heading to the border as the migrant caravan approaches,1
do you know that new york state pays out way more than they ever get back,1
west virginia added the highest percentage of new construction jobs in 2017 in the united states at 144 this amounted to 4300 additional jobs in fact wv was the only state with doubledigit growth,1
household income among hispanic americans has just set a new record high,1
west virginia has the highest overdose rate per capita of any state in our nation,1
matt rosendale supports plans that dont have to cover preexisting conditions,1
on spending growth under gov andrew cuomo despite the fact that you continue to suggest that youve been able to hold the two percent you havent,1
my opponent is endorsed by citizens united,1
thousands of folks are opening west virginia ezpass accounts,1
black lung cases are at a 25year high,1
the poverty rates for african americans and hispanic americans its been incredible theyve all reached their lowest levels in the history of our country,1
says rick scotts hospital company stole millions defrauding the militarys health care program,1
mark harris has said he would abolish the department of education,1
he even supports putting a female inmate in shackles during childbirth,1
says only one other senator from either party over the last 25 years has a worse record on bipartisanship than ted cruz,1
leah vukmir opposes buy american legislation,1
in west virginia personal income tax collections were up 14 from 2017,1
since passage of the tax cuts and jobs act walmart increased their starting wage to 11hr has given about 400 million in bonuses,1
most of kathy mannings donors are from outofstate,1
the national economy was strong in its largest expansion of private sector jobs before president trump came into office,1
i think i received more votes in the democratic primary than any governor in history,1
close to half of the children in california are at or near poverty when you consider costofliving,1
says sean hannity told listeners of his radio show that beto orourke is asking for help in getting undocumented to vote,1
says a josh hawley lawsuit would take away important prescription drug coverage for seniors through medicare and end all of the consumer protections under the aca,1
says the trump administration transferred 10 million from fema to ice,1
says texas high school graduation rates are at alltime highs,1
for only the second time since 2000 there are more job openings than americans who are unemployed,1
this year west virginia produced more americorps members than any other state,1
says hes a smalltown supervisor who has kept a balanced budget who has increased surpluses who has led us to the highest credit rating our town has ever had,1
if you are a gun store owner and you decide to go out of business you right now are allowed to convert your entire gun store inventory to personal use and once it is a personal use weapon you can sell it without background checks,1
the american economy is continuing its longest monthly streak of job growth in history with 39 million jobs added since president trump was elected,1
says beto orourke has a criminal record that includes dwi and burglary arrests,1
apple and amazon already operate in many states that require levels of voter id,1
i dont take a dime of pac money,1
says leah vukmir claimed the open records law didnt apply to her got sued lost and cost taxpayers 15000 in legal fees,1
one out of every 30 people in the greater boston area is an illegal alien,1
says hes never voted present in the house instead of taking a yes or no position,1
in 2017 ice arrested more than 127000 illegal immigrants with criminal convictions or facing charges of breaking our nations laws and removed nearly 5000 gang members,1
in december of 2017 the prince william board of supervisors had a meeting corey stewart skipped that meeting to go campaign in alabama for roy moore to be a u s senator you havent disavowed roy moores name yet,1
lets talk about the facts and where we are today there are still nearly 2600 children who are separated from their parents due to the trump administrations zerotolerance policy,1
the railroad commission of texas has nothing to do with railroads,1
the three wealthiest people own more wealth than the bottom half of the american people,1
since 2014 each year nato nations have been increasing their contributions,1
there isnt a system for reuniting families separated under trumps zero tolerance border policy,1
migrant mother and crying girl on time cover never separated,1
since taking office we have enacted more than 8 billion in cumulative tax relief,1
under emanuel cps has become the most understaffed school district in illinois,1
when you tally up their representation in congress and governorships the democrats almost have their lowest representation in about 100 years,1
says most of austins biggest parks have recycling though as many as 293 out of 300 austin city parks have no recycling including almost every neighborhood park,1
ohios payday lending laws are now the worst in the nation things have gotten so bad that it is legal to charge 594 percent interest on loans,1
says our indicted attorney general ken paxton is back to being the only statewide official in the country under indictment,1
weve been down this road beforeblanket protectionism is a big part of why america had a great depression,1
its against the law in texas to let any loaded gun get in the hands of a child,1
democrats mistakenly tweet 2014 pictures from obamas term showing children from the border in steel cages,1
senator cryin chuck schumer fought hard against the bad iran deal even going at it with president obama then voted against it now he says i should not have terminated the deal,1
taking into account inflation the federal minimum wage is actually worth less than what it was worth 50 years ago,1
you know what amazon paid in federal income taxes last year zero,1
says mitt romney is using a million of his presidential campaign dollars to finance his utah senate race,1
after the minimum wage for tipped workers was raised in maine the state reversed that decision due to restaurant employees organizing en masse against the measure,1
black and latino people in nyc are arrested at ten times the rate of white people for virtually the same rate of marijuana usage,1
a majority of americans now live in states where they have decided to legalize cannabis including recreational and medical marijuana,1
here are the facts there is no massive wave of migrants pouring into california overall immigrant apprehensions on the border last year were as low as theyve been in nearly 50 years and 85 percent of the apprehensions occurred outside of california,1
