cleanText,new_labels_1
says theres no language in the u s constitution that prevents someone from running for congress simultaneously in multiple states,1
the united states has never been richer if you look at per capita gdp,1
the deficit this year could pay all of the 2013 salaries of every professional baseball player for the next 248 years,1
says new jersey has gained 143000 new privatesector jobs,1
i have returned money every year since taking office,1
during my eight years as county executive we cut the number of county workers by 20 percent,1
says the affordable care act has already reduced the number of uninsured in oregon by 10 percent,1
things went wrong with the medicare prescription d plan that george bush rolled out,1
finance experts estimate that paying in cash for the 25 billion in projects funded by the sales tax saved gwinnett county more than 1 billion in interest payments,1
says 18 states and the district of columbia have voted democratic in six consecutive presidential elections,1
in fact theres more state funding for education today than any other time,1
a million people could get health insurance right away if texas expanded medicaid under obamacare,1
says taxpayer subsidy for the oregon convention center hotel jumped 100 million in closeddoor sessions,1
congress is bewildered at the scope and reach of our spying apparatus but in 2008 and 2012 explicitly rejected an amendment calling for more disclosure,1
says rick scott didnt even come to his own education summit but he did take time to go to the tea party convention the same week,1
before the republican wave in 2010 democrats had an advantage on the generic ballot in congress even in 1994 with the gingrich revolution democrats had that advantage,1
rand pauls speech on gattaca was totally ripped off of wikipedia,1
even after obamacare is fully implemented there still will be tens of millions of people not covered,1
under president george w bush we added 49 trillion to the debt under president obama weve added 65 trillion to the debt,1
most voters prefer zombies to the current u s congress,1
the u s department of homeland security warned that the save database is not a foolproof means of verifying citizenship on the voter rolls,1
in massachusetts half of the primary care doctors are not accepting new patients,1
a congressional laundry closed due to the partial government shutdown,1
ninety six percent of employers in the granite state are considered small businesses,1
says oregonians for food and shelter proudly features board members from monsanto and syngenta and the oregon farm bureau also receives funding from biotech companies,1
many dont know that bill young was once the minority leader in the florida senate because he was the only republican senator,1
for the first time since the korean war total federal spending has gone down for two years in a row,1
there is a constitutional issue that affects the paychecks of members of congress during a shutdown,1
photo id is not required for those who vote by mail,1
many state and federal agencies have such navigators involved in helping folks maneuver through the often complex processes associated with filing benefits claims for example even buying health insurance,1
i would be the first republican senator elected in new jersey in 41 years,1
there are still tens of thousands of missing service members from previous and current conflicts that our nation is working to find and repatriate,1
the highest paid employee of the state of rhode island is a basketball coach,1
if sea levels rise six feet due to climate change waterplace park in providence and wickford village would be swamped,1
the very first meal on the surface of the moon was the holy communion,1
president barack obama had the legal authority to strike syria without a vote from congress,1
the government does not need a warrant to read your old emails,1
says he would be first cpa to serve as texas comptroller,1
trenton politicians cut 13 billion from education,1
over the past twenty years the number of homicides committed with a firearm in the united states has decreased by nearly 40 percent the number of other crimes involving the use of a firearm has also plummeted declining by nearly 70 percent,1
according to a recent poll there are more young republicans enrolled in their parents health insurance plans than young democrats,1
americans spend more than 160 billion and 6 billion hours per year complying with the tax code,1
fleeing syria a million children are now refugees,1
the city of portland has won more national constitution contests than any city in america,1
says that unlike texas missouri has a perfect aaa credit rating,1
says u s sen ron johnson voted to let oil and gas companies emit unlimited carbon pollution into our air,1
state law says that once the state appraises a piece of property they can only pay it a certain amount above appraisal,1
says he sued obamas epa seven times,1
we now sell more products made in america to the rest of the world than ever before,1
polls show that 96 percent of new jerseyans and 95 percent of gun households in the state support expanding background checks to keep guns away from those who shouldnt have them,1
under obamacare members of congress are required to purchase their health insurance from the new exchanges,1
why didnt uninsured americans buy insurance because of the expense,1
since the affordable care act passed 90 percent of job growth has been in fulltime positions,1
this year the overwhelming majority of new jobs are part time,1
says by rejecting an expansion of medicaid under the new law georgia was depriving 25000 veterans of health care coverage,1
in fact new jersey is a donor state we get 61 cents back on every dollar we send to washington and interestingly kentucky gets 151 on every dollar they send to washington,1
theyve seen employersupported coverage increase in massachusetts after this law romneycare was implemented,1
says the state department spent 630000 to get 2 million facebook likes,1
the congressional budget office a nonpartisan office did an analysis and said that passing comprehensive immigration reform will reduce the federal deficit by 200 billion over the next decade,1
more than 72 percent of children in the africanamerican community are born out of wedlock,1
every single month since 1985 has been warmer than the historic average all 12 of the warmest years on record have come in the last 15 years,1
the senate immigration bill is filled with things like rewards for au pair agencies alaskan seafood processors and vegas casinos,1
says our deficits are falling at the fastest rate in 60 years,1
the income of the top 1 percent nearly quadrupled from 1979 to 2007 but the typical familys incomes barely budged,1
there was a gallup poll in egypt last year and 70 percent of egyptians dont want our money,1
economic development commission executive director keith stokes sent me a letter and he said the taxpayers will never be on the hook for these bonds for 38 studios,1
it is against the law for the nsa to record or monitor americans phone calls without getting a specific fisa warrant to do so,1
says spending in the fiscal 2009 budget was lower than spending in the fiscal 2014 budget,1
in south florida weve had nine inches of sealevel rise since the 1920s,1
bob barr has changed his position on the defense of marriage act over the years,1
if it is enacted the senate immigration bill is going to make the border patrol bigger than the fbi you could put one agent every 250 feet,1
the united states government and its constitution says that people can be put to death,1
says delaware county has more waterfront property than any other county in the state of ohio,1
says proposed teacher contract would layer on more restrictive rules,1
says 97 percent of food stamp benefits are paid in the proper amounts to people who are really eligible,1
we have one of the most expensive general assemblies per capita in the entire country,1
since newtown more people have died at the end of a gun than we have lost in afghanistan,1
hidden in the healthcare gov code is language that means users waive any reasonable right to privacy of your personal information,0
dems want billions to go to insurance companies to bail out donors,0
says sen chuck schumer in 2014 helped put together and signed a 25 billion deal to fund a border wall and now opposes trumps 5 billion request for a border wall just because hes a republican,0
about a third of texas has seen a 2025 population loss in the last 5 years,0
u s farmers are receiving 16 billion out of the tariffs that weve gotten from china,0
government orders south african firm to lay off 3389 white employees,0
as mayor of newark n j cory booker stole 600000 from a city water authority and laundered it through his law firm,0
says donald trump won the ellis island award for patriotism tolerance brotherhood and diversity alongside muhammad ali and rosa parks,0
its actually the safest time to fly,0
republicans looking to cut social security as much as 50 percent immediately,0
the nytimes states today that djt believes more countries should acquire nuclear weapons how dishonest are they i never said this,0
we can fix our roads without raising taxes,0
there is a 34 percent increase in violent crime in the state of california and thats just within the last year,0
weve seen the increase of alcohol use for underage kids even though alcohol has been illegal for kids under 21,0
nancy pelosis brothers company received 737 million from obamas energy dept,0
it is shocking to me that police commissioner richard ross and mayor jim kenney allowed this illegal occupation to go on for hours without taking any action to enforce the law,0
says a new york physician and his wife jumped to their deaths because they cant afford obamacare,0
a north carolina study proves that probably over a million people voted twice in the 2012 election,0
says hillary clinton wants to essentially abolish the second amendment,0
carbon dioxide is not a primary contributor to the global warming that we see,0
under rosemary lehmberg the travis county d a s office convened the grand jury that indicted rick perry,0
if congress fails to act the obama administration intends to give away control of the internet to an international body akin to the united nations,0
says ralph hall is the oldest member in congress ever,0
bryan county ga has corrupted voter rolls,0
rauner made you pay for abortions in all nine months of pregnancy,0
photos show the whistleblower with nancy pelosi and hillary clinton,0
the cheerleaders for the dallas cowboys have entertained more troops in the world than bob hope,0
says joe biden has written a letter of apology for calling trumps travel restrictions from china xenophobic,0
president trump has signed more bills into law than any president previously before at this stage in the game,0
in the united states alone we lose more than 3000 people a day to cancer,0
the state of new york is the worst in the nation in economic recovery,0
seven days before john f kennedy was assassinated he said theres a plot in this country to enslave every man woman and child before i leave this high and noble office i intend to expose this plot,0
george floyds death and the ensuing protests were planned to introduce martial law and purge the united states,0
during the nixon watergate investigation out of courtesy the fbi started reporting to the department of justice but there was nothing official,0
ashley moody was a lifelong democrat,0
mayor andrew gillum says hes indefinitely suspending his campaign for governor in light of a fatal shooting in tallahassee at a yoga studio on friday,0
workers have begun removing spires of cinderella castle at magic kingdom ahead of hurricane dorian,0
a retired u s army sergeant faces life in prison for killing two syrian refugees after discovering they raped his teenage daughter,0
u n official john ashe set to testify against the clintons may not have died by accident,0
qataris dont really work,0
says a photo shows cnn chyrons that read democrats ask why even have a second amendment and cnn exclusive china cracks down on pro democracy demonstrators,0
mexico is paying for the wall through the new usmca trade deal,0
the pell bridge is a tourism bridge essentially and not a commuter bridge,0
rhode island has the highest percentage of lawyers per capita in the country,0
says beto orourke voted against body armor for texas sheriffs patrolling the border,0
says scott walker left college under an ethical cloud for having tried to fix the election for student body president,0
says actor dwayne the rock johnson wore a tshirt stating we stand for the flag we kneel for the fallen,0
says tom hanks has a volleyball to keep him company while hes quarantined,0
most of west virginia is still owned in excess of 90 percent by outofstate interests,0
says barack obama has gone from blaming george w bush to plagiarizing george w bush,0
roy moore fought for pay increases for politicians while courts had to shut down because of lack of funding,0
says cnns chris cuomo never asked sen richard blumenthal about blumenthals misstatements on his own service in vietnam,0
were the worst state in the country at moving people from welfare to work,0
after enactment of the republican tax bill school teachers can no longer deduct the cost of their classroom supplies on their taxes,0
93 of the covid19 cases in the state of illinois have come from chicago,0
even the congressional budget office says if you lower medicare to allow 50 year olds to get into it you can not only save the government money but you can lower premiums for all americans,0
says republican gov phil scott just voted to impeach president trump,0
nancy pelosi said if you accept a check from trump you might as well vote for him,0
more americans receive food aid than work in the private sector,0
there are paid protesters involved in the stephon clark demonstrations,0
says patrick morrisey ran for congress in nj as prochoice,0
when i was growing up as a kid in the city of milwaukee if we averaged 4 homicides a year in the entire city that was a record number,0
says president barack obama made it legal for the media to purposely lie to the public when he quietly signed into law hr 4310 in 2012,0
says harry reid when asked about the republican field said the republican he likes the best is donald trump and he said because i can work with him hell cut deals,0
under the nuclear nonproliferation treaty enrichment has been limited to basically the weapons states,0
photo shows bernie sanders at the 1969 stonewall riots,0
says a video shows a fox allowing itself to feed koala babies in australia,0
michigan governor gretchen whitmer bans buying us flags during lockdown,0
as a result of obamacare california seniors face benefit cuts of over 1700,0
says after australia passed a new law that forced gun owners to give up over 640000 firearms the country saw a dramatic increase in homicides assaults and robberies,0
says his job approval poll numbers are not bad relative to other presidents at this point in his presidency,0
seventy four percent of californians are absolutely against sanctuary state policies,0
in her campaign for president hillary clinton has received 100 million in contributions from wall street and hedge funds,0
says the cdc recommends men shave their beards to protect against coronavirus,0
says donald trump said make no mistake theyre not after me they are after you your guns your christian values your freedom im just in their way,0
hillary clinton is for open borders,0
the affordable care act is the single largest tax increase in my lifetime,0
only after news broke that our veterans are dying because of inadequate health care did harry reid and senate democrats take action,0
says former starbucks ceo howard schultz once said that he would hire an illegal immigrant before he would hire a veteran,0
the white house fully cooperated with the special counsels investigation,0
millionaires working side by side with george soros are bankrolling john kasichs super pac,0
we know dangerous criminals can slip through immigration at airports just like ours yet joe donnelly stood right here with the radical left against all efforts to secure our most vulnerable entry points,0
the next state budget will begin with a surplus of over half a billion dollars 535 million to be exact,0
burka clad woman runs over baby gets away with crime for one stunning reason,0
glenn hegar promised to eliminate the property tax,0
says the obamas are connected to the varsity blues college admissions scandal,0
supreme court nominee merrick garland voted to uphold d c s ban on handguns,0
says donald trump doesnt make a thing in america,0
more people are losing their insurance due to obamacare than are becoming newly insured,0
barack obama is the first expresident to ever speak against his successor,0
says video shows the chinese are destroying the 5g poles as they are aware that it is the thing triggering the corona symptoms,0
breaking uk prepares for full lockdown after hundreds of new cases wuhan super virus updates,0
with voting by mail you get thousands and thousands of people sitting in somebodys living room signing ballots all over the place,0
says bernie sanders was indifferent to russias annexation of crimea because he felt they have a lot of russians anyway,0
texas 2 in nation for new gun purchases behind california,0
says a 125 million incentive deal she approved for abbott laboratories contained strong protections for taxpayers if job creation goals were not met,0
says if an unmarked car tries to pull you over you should dial 112 to confirm its actually a police officer because the number provides a direct link to state trooper info and that this applies in all 50 states,0
jason carters plan increase spending by 125 billion,0
the president and vice president cant be from the same state,0
says the new york times reported that hillary clinton and george soros paid a woman to accuse trump of sexual attack,0
the mitchell park domes lose about 1 millionplus every year and the number of people going to the domes has been going down,0
says president barack obama never said no boots on the ground in syria,0
says george soros said im going to bring down the united states by funding black hate groups well put them into a mental trap and make them blame white people the black community is the easiest to manipulate,0
im the first democrat to ever lead scott walker in an election year,0
says a series of photos show iranian rockets being launched toward u s air bases in iraq,0
because of president barack obamas failure to push job creation the black unemployment rate in ferguson mo is three times higher than the white unemployment rate,0
says jeb bush and marco rubio had it set so that the winner takes everything because they wanted to make sure that i didnt get anything in the florida primary,0
says brooke baldwin said dont hire veterans theyre too damaged to be trusted with authority,0
the founders of new hampshire came up with the motto live free or die,0
isis is infiltrating america and using syrians to do it,0
says television host steve harvey authored a protrump rant about raccoons and exterminators,0
ive been involved in prosecuting a terrorist member of isis,0
every county in the state of texas has a veterans court,0
the big wall street banks the big corporations give many times more political donations to democrats than republicans,0
says a quote defending president donald trump can be attributed to clint eastwood,0
experts estimate that 40 percent of gun sales occur in noquestionsasked transactions that often take place at gun shows or on the internet,0
says islamic studies professor tariq ramadan said muslims are here to colonize the u s and canada and spread sharia law and wont hesitate to use violent jihad if they have to,0
the woman in this photograph is margaret sanger founder of planned parenthood meeting with the ku klux klan in 1926 silver lake new jersey,0
fact joe biden pressured ukraine to fire its prosecutor fact the prosecutor said he was forced out for leading a corruption probe into hunter bidens company fact democrats want to impeach president trump for discussing this investigation with ukraines president,0
says aftab pureval is lying about his offices 400000 projected deficit,0
says the sons of nancy pelosi mitt romney and john kerry are all on the boards of energy companies doing business in ukraine,0
says all my grandparents immigrated to america,0
ive either balanced every budget or we turned back a surplus,0
we essentially repealed obamacare because we got rid of the individual mandate and that was a primary source of funding of obamacare,0
nevada lawmakers permanently cut taxes for over 95 percent of nevadas businesses,0
the clinton camp was the first to get it out there and try to say there was something untoward about the speech that melania trump gave,0
we dont have a military reserve force if something happens,0
says his conviction is a political witch hunt by holdovers in the obama justice department,0
charlottes antidiscrimination ordinance would have opened all bathrooms to all sexes at all times if it hadnt been overturned,0
i think were actually ahead on legalizing marijuana for recreational use in new york state,0
says your legislative assembly was within one vote of enacting each of those bills into oregon law,0
says a sanders campaign ad never said a newspaper endorsed us that did not,0
says gov tony evers vetoed a school computer program saying it would be better spent in urban districts like madison and milwaukee,0
this year a majority of states are seeing premiums and costs double under obamacare,0
video shows seattle police in uniform vandalizing a building to frame protesters,0
says the democratic party took social security from the independent trust fund and put it into the general fund so that congress could spend it and eliminated the income tax deduction for social security fica withholding,0
video shows president donald trump saying covid19 is democrats new hoax,0
says sen dianne feinstein said if she had 51 votes in the senate for mr and ms america turn in all of your guns they would do it,0
says president barack obama spent nearly a trillion dollars on makework government jobs,0
bernie sanders is a communist,0
every year we spend roughly 500 billion on tax compliance that is roughly the budget of our entire military entirely wasted on tax compliance,0
theyre furloughing nurses in hospitals in western new york state,0
nate mcmurray lobbied to send our jobs to china and korea too,0
hillary clinton lied many times to the fbi,0
i dont know who jonathan gruber is,0
says qassem soleimani assisted in the clandestine travel to afghanistan of 10 of the 12 terrorists who carried out the september 11 terrorist attacks in the united states,0
says alexandria ocasiocortez weeps over empty parking lot,0
factcheck org exposed snopes com as an extremely liberal propaganda site with an agenda to discredit anything that appears to be conservative,0
doctors kill about 250000 people a year in botched surgeries,0
the cdc can detain anyone with a fever indefinitely vaccination is a way people could get out of detention,0
the five guantanamo detainees swapped for bowe bergdahl are right now back on the battlefield,0
89000 children were separated from their parents under obama and only 1900 children have been separated under trump,0
small businesses are going out of business in record numbers,0
says the usmca is the biggest trade deal ever made,0
says that after the last income tax increase in the state of illinois we saw the largest exodus of middleincome families,0
amendment 1 protects florida seniors from scams and ripoffs,0
because the federal reserve recently cut interest rates to near 0 the fed will be of little consequence now theyve already used what leverage they have,0
says michigan gov gretchen whitmers family spent may 20 at her second home breaking her own stayathome orders,0
wind power is the most undependable form of renewable energy,0
photos prove the denver light rail system has low ridership,0
a colgate toothpaste is subject to recall,0
says the 2019 coronavirus causes sudden death syndrome,0
says the koch brothers want to protect tax cuts for companies that ship our jobs overseas,0
says he saw videotape of the people taking the money off the plane to pay ransom to iran for hostages,0
the music industry is the biggest export from africa after oil and gas,0
the media was silent that the colorado school shooter is a transsexual trumphating christianhating leftist freak,0
wisconsins middle class is the most diminished in the united states,0
says president trump donated his second quarter salary to rebuild military cemeteries and that the media ignored it and every other story of him donating his salary as potus,0
zero percent of kids in cairo are collegeready,0
a proposed san antonio ordinance will allow men into womens restrooms in the city,0
the profit from automated traffic enforcement cameras is going to the private corporations not to the city or state,0
they delayed my swearingin here in massachusetts for a couple weeks so they could ram the health care law through,0
says patrick morrisey undertook efforts to put educators in jail,0
if you paid rent in march or april they got to give you your money back,0
i am very proud that i am the only candidate in the democratic primary to have voted against all of trumps defense budgets,0
says president donald trump fired lt col vindman because he testified agaisnt sic him and corroborated the whistleblowers sic testimony,0
says marie yovanovitch was dishonest when she claimed under oath that she never personally responded to an email from a democratic staffer but in fact it turns out that she did respond,0
ron howard wrote a facebook post about being a liberal,0
