cleanText,new_labels_1
speakers at the democratic national convention made zero mentions of the global terrorist threat posed by isis,1
i wake up every morning in a house the white house that was built by slaves,1
we created 800000 new jobs we cut the unemployment rate almost in half and today new york state has more private sector jobs than it has ever had in its history,1
an amendment pushed by lyndon johnson many years ago threatens religious institutions with a loss of their taxexempt status if they openly advocate their political views,1
our trade deficit in goods reached nearly 800 billion last year alone,1
fortythree million americans are on food stamps,1
for decades the states gas tax has been among the highest in the nation,1
says hillary clinton said all workrelated emails were sent back to the state department the fbi director said thats not true,1
there are at least twice as many licensed firearm dealers in california as there are mcdonalds,1
says gary farmers claim that he received an a from the nra is an absolute lie,1
over the last six years the state of illinois spent about 320 million on illegal immigrants,1
a shocking 20 veterans are committing suicide each and every day especially our older veterans,1
says gop senate nominee darryl glenn said he wants to see ted cruz appointed to the u s supreme court,1
the united states is the oldest democracy in the world,1
says donald trump wants to get rid of the federal minimum wage,1
more people now die in wisconsin from drug overdoses than car crashes,1
proposed nc law for body camera footage gives police broad authority to keep video footage secret even from individuals who are filmed,1
says donald trumps proposed tax treatment of hedge fund managers makes the current loophole even worse,1
if you are a member of union your median weekly income is roughly 200 more than if you are a nonunion member and that doesnt include benefits,1
risk analysts listed donald trump a donald trump presidency as one of the top threats facing the global economy ahead of terrorism,1
the major immigration issue was about poles and bulgarians and romanians and that they werent contributing economically the unemployment rate among poles in britain is lower than the unemployment rate among brits,1
the national park service has an annual budget that is less than the city of austin,1
says donald trump called pregnant employees an inconvenience,1
the lgbt community is more often the victims of hate crimes than any other recognized group,1
says hillary clinton said she was under attack in bosnia but the attack turned out to be young girls handing her flowers,1
says kelly ayotte voted again yesterday against a proposal to expand background checks buyers can continue to simply go online or to gun shows to purchase guns without background checks,1
swaziland has the highest rate of hiv infection in the world,1
nine million people have lowercost hivaids medicine because of the work of the clinton foundation and my husband,1
only half of the murders in the city of st louis get solved,1
says donald trump mocked someone with a disability,1
the labor force participation rate the share of the potential workforce that is actually working or looking for work currently stands below 63 the lowest level since the 1970s,1
since 1978 college tuition nationwide has gone up something like four times the rate of inflation,1
a trade war is something very different than curbing new trade agreements we went down that road in the 1930s it made the great depression longer and more painful,1
the 2015 legislature passed the fewest laws in 20 years,1
the chicago bears have had more starting quarterbacks in the last 10 years than the total number of tenured uw faculty fired during the last two decades,1
say video shows massive alligator strolling across florida golf course,1
vietnamese is the third most commonly spoken language in texas,1
when i was secretary of state i had a very high approval rating,1
you can import as many hemp products into this country as you want but we cant grow it,1
we now do have evidence that donald trump is being used as a recruiting tool for terrorists,1
before 2005 the percentage of texas high school students meeting the college readiness standards of the texas higher education coordinating board stood at 28 in english and 42 in math those figures stood at 65 and 66 in 2013,1
under donald trumps tax plan the top 01 percent of taxpayers people earning multiple millions of dollars a year on average would get more tax relief than the bottom 60 percent of taxpayers combined,1
the united states has a low voter turnout rate,1
austin is number one in texas in startups venture capital and patents,1
for the first time in over 40 years republicans dont hold a single statewide office in virginia,1
the city of clarkston cant decriminalize marijuana only state legislators and congress can do that,1
says 15anhour proposal in cleveland is the most aggressive minimum wage increase in the country,1
before april 22 we have restored the rights of more than 18000 individuals which is more than the past seven governors combined in their fouryear terms,1
closing the tobacco loophole would save missouri taxpayers 50000000,1
after my first year as governor i was one of the most unpopular governors maybe the most unpopular governor in the country it changed,1
in two years gov mcauliffe has vetoed more bills that the previous three governors issued in each of their fouryear terms,1
north carolina has one of the fastest growing populations as well as the fastest growing economy in the country,1
pat toomey advocated for eliminating all corporate taxes,1
says he was the only republican to vote against creating a house panel to investigate planned parenthood,1
i earned more votes in the state of wisconsin than donald trump did in new york,1
a tax on soda and juice drinks would disproportionately increase taxes on lowincome families in philadelphia,1
as a former federal prosecutor i prosecuted over 4000 cases,1
says republican presidential candidate and gov john kasich has spent 177 days out of state and used 350000 in taxpayer money on his costly campaign,1
says new hampshires second congressional district includes two counties where almost 5 percent if not more of residents are enrolled in the states expanded medicaid program,1
in nine democratic debates weve not had one question about a womans right to make her own decisions about reproductive health care not one question,1
right now here in texas wind power is already cheaper than dirty fossil fuels,1
in malaysia many of the workers are indentured servants because their passports are taken away when they come into this country and are working in slavelike conditions,1
states with the highest gun ownership rates also have the highest suicide rates,1
polls show hillary clinton wins every time with donald trump as her opponent,1
more people are struck by lightning than commit inperson voter fraud by impersonation,1
the barber regulation here in missouri is 10000 words longthe book of revelation is also 10000 words long,1
when it comes to fighting terrorism another thing we know that does not work based on lots of empirical evidence is torture,1
big soda has a lot of money they make a lot of profit off their product and they market in neighborhoods that suffer from these very things that were trying to cure,1
since 1900 six u s supreme court justices have been confirmed during election years including justice anthony kennedy who was confirmed in the final year of the reagan administration,1
during three and a half years of campaigning lamar smith has never once appeared at a moderated debate to defend his positions on the issues,1
virginia now is the number one exporter of agricultural products to cuba we have now jumped to number one,1
bernie sanders passed more roll call amendments in a republican congress than any other member,1
according to the centers for disease control and prevention cdc about 120 americans on average die from a drug overdose every day overall drug overdose deaths now outnumber deaths from firearms,1
we do not have an overcrowding problem as a matter of fact rhode island has one of the lowest incarceration rates in the country,1
six justices on the u s supreme court have been confirmed in presidential election years since 1912,1
six justices on the u s supreme court have been confirmed in presidential election years since 1912,1
says a youtube video shows thomas dimassimo the man who rushed trump at an ohio rally dragging the american flag on the ground like it was a piece of garbage,1
gun violence is by far the leading cause of death for young african american men outstripping the next nine causes of death combined,1
the u s doesnt make television sets anymore,1
one would have to go back more than a century to find a scenario where a presidents nominee for the supreme court was confirmed by the opposition party in the senate when the vacancy occurred during an election year,1
we understand that this heroin is primarily coming from mexico over the border,1
the walton family of walmart this one family owns more wealth than the bottom 40 percent of the american people,1
more than once ive actually had a conversation with the protesters on substance,1
foreign aid is less than 1 percent of our federal budget,1
when the city and the fairmount park conservancy invested 5 million in hunting park crime went down 89 percent within a half mile radius of the park over the next three years,1
like marco rubio sen barack obama had one of the worst attendance records in the senate,1
theres no correlation between primary turnout and wins in the fall in the last 11 elections,1
there have been multiple media reports about donald trumps business dealings with the mob with the mafia,1
texas is home to millions of latinas but the state has never elected a latina to congress,1
building a wall on the u s mexico border will take literally years,1
africanamericans are more likely to be arrested by police and sentenced to longer prison terms for doing the same thing that whites do,1
theres never been a u s supreme court vacancy in the last i think 30 years lasting longer than 237 days,1
people have actually broken down the transcripts for oral arguments and antonin scalia told more jokes and got more laughs than any of the other justices,1
we are almost halfway to our goal of 1000 rapes prosecuted,1
says donald trump supported impeachment of president george w bush,1
north koreas missiles are not going to have a capability to reach the united states anytime real soon,1
the africanamerican community lost half of their wealth as a result of the wall street collapse,1
says president john f kennedy released a star green bay packer from military reserve duty so that he could play in the 1961 nfl championship game,1
says she is 6th in hard dollars raised and has more cash on hand than governors john kasich and chris christie combined,1
owen in ma vs owen in ri advantagerhode island,1
china is practicing how to blow up our satellites,1
i am the only candidate that has endorsed bernie sanders for president in pa ive got bernies back,1
it is rare that a retirement grade determination is conducted for an officer previously retired from the u s armed forces,1
texas is growing twice as fast as the rest of the country,1
when a gallup poll asked about presidential candidate characteristics when they get to the question on would you vote for a socialist it is even less popular than voting for atheists,1
since john f kennedy was assassinated in 1963 more americans have died by gunfire within our own country than american servicemen and women who were killed in all our wars,1
anyone can die of a toothache,1
in 40 years of broadcast i have never endorsed any candidate,1
two million new jobs have been created in california since 2011,1
today if you were raised poor youre just as likely to stay poor as you were 50 years ago,1
says bernie sanders has reversed his position on immunity for gun manufacturers and sellers,1
boston is just 60 minutes away and its offering subsidies to developers who can charge higher rent than you can get in providence while construction costs are more or less equal as a result the boston skyline is completely dominated by the cranes,1
says marco rubio knows full well i voted for his amendment to increase military spending to 697 billion,1
our businesses have created jobs every single month since obamacare became law,1
lets start with the premise that rhode island already has one of the 10 strictest gun laws amongst all the states,1
guantanamo has never been a key component of isis or alqaida propaganda,1
here in wisconsin weve put in previous budgets more money into mental health services than any governor has in the last 25 years,1
says american polling shows russian president vladimir putin has an 80 percent approval rating,1
the united states spends almost three times per capita what they spend in the u k on health care and 50 percent more than they pay in france,1
if you are going to kill the families of terrorists realize that theres something called the geneva convention were going to have to pull out of,1
since 2008 gwinnett countys population has grown 15 percent while the county government staff has increased only 1 percent,1
the u s tax rate on successful small businesses is 446 percent while the business tax rate in canada is 15 percent,1
since 2008 we have cut 5000 positions from virginia public schools,1
probably less than 4 percent of wisconsin residents are enjoying the subsidies from obamacare,1
the number of people in atlanta dying from hiv and aids declined 59 percent between 2004 and 2012,1
twentyfive percent of our kids in foster care are there because their parents are involved in drugs,1
the world food demand is going to double sometime between now and 2070,1
says president barack obama will not utter the words radical islamic terrorism and as matter of policy nobody in the administration will say the words radical islamic terrorism,1
more black babies are aborted in nyc than born,1
instead of fighting isis the saudis have focused more on a campaign to oust iranbacked houthi rebels in yemen,1
wisconsins 6th congressional district has more manufacturing jobs than almost any other in the nation,1
when president barack obama said isis or isil was contained he was responding very specifically to the geographic expansion of isil in iraq and syria,1
says income tax rates under eisenhower were as high as 90 percent,1
will hurd tends to have a 96 percent straight republican straight party voting record,1
there are more words in the irs code than there are in the bible,1
marco rubio spent 400k of your tax dollars remodeling offices and building a membersonly lounge,1
most americans are ready to put it marijuana prohibition behind us and move on,1
dark money spending in the 2016 election cycle is 10 times what it was at the same point in the 2012 election cycle when it topped 308 million,1
electric car sales in georgia have dropped dramatically since a 5000 tax credit was eliminated and a 200 annual registration fee was imposed july 1,1
a texas police department bought an ad telling drug dealers we can take your competition off the streets for free,1
in 2008 thensen barack obama missed 60 or 70 percent of his votes in 2004 john kerry missed close to 60 to 70 percent and bob graham missed over 30 percent of his votes,1
after today govjaynixon will have been overridden more times than all previous governors in mo history moleg,1
brewpubs cant sell growlers of their beer to customers,1
60 percent of all americans do not want to see planned parenthood defunded,1
sen sanders did vote five times against the brady bill,1
says donald trump supports eminent domain and the supreme courts kelo decision,1
90 of americans want national background checks that close loopholes,1
since 2008 u s crude oil output has increased by over 80 percent an increase of over 4 million barrels a day that is the fastest increase in u s history,1
we have 650 people who move to texas every day,1
says bernie sanders was there when it came to samesex marriage 20 years ago he was there when it wasnt popular,1
theres no money for planned parenthood in the bill that would keep the government open,1
six of the 10 richest counties in the united states surround washington d c,1
the racial and ethnic makeup of the gwinnett county sheriffs office mirrors the community it serves,1
on the main gop presidential debate not one candidate on the debate stage has military experience,1
no openly gay man has ever been elected to the georgia legislature,1
tens of thousands of atlanta households pay more than 30 percent of their income towards rent,1
just about half of rural hospitals operate in the red in virginia they operate at a loss,1
eightythree law enforcement officers have died in the line of duty this year twentyfour of them were shot and killed in cold blood,1
the marijuana that kids are smoking today is not the same as the marijuana that jeb bush smoked 40 years ago,1
georgias crct set some of the lowest expectations for student proficiency in the nation,1
im the only governor in america who signed a law that says there needs to be an independent investigation any time theres a death of someone in police custody,1
the state of texas is funding womens health services at historically high levels they just increased their level another 50 million for the next two years,1
trump proposed enacting the largest tax increase in american history,1
georgia has the 9th highest rate of adults ages 18 to 64 without a high school diploma or ged,1
of the 25 wealthiest nations were the only one that doesnt provide basic health coverage,1
saudi arabia has the thirdlargest military budget in the entire world,1
by the end of this budget im in right now taxes will have been cut 47 billion in my state,1
more americans have died from guns in the united states since 1968 than on battlefields of all the wars in american history,1
says ron johnson opposes entirely a federal minimum wage except perhaps for guest workers,1
to vote in mexico every eligible mexican citizen has to have a tamperproof photoid card with a thumbprint and an embossed hologram,1
last year we had zero percent growth in gdp in virginia the only states that did worse than us were alaska and mississippi,1
there are actually only 30 countries that practice birthright citizenship,1
less than half of the poorest american households have a home internet subscription,1
youre more likely to get struck by lightning in texas than find inperson voter fraud,1
says donald trump has changed his mind on abortion,1
africanamerican children are 500 percent more likely to die from asthma than white kids,1
the republican presidential nominee hasnt won women since 1988,1
since volvo spurned georgia for south carolina in early may some 3455 jobs promising more than 800 million in investments have come to the peach state,1
the majority of the hispanic population and the growth of the population is u s born,1
with the exception of baby formula the federal government does not require any food to carry an expiration date and state laws vary widely,1
says david jolly refused to cut spending for a national greenhouse in d c,1
hillary clintons state department actually admonished one of her ambassadors because he wasnt using the proper server,1
says donald trump has supported a canadianstyle universal health care system,1
the murder rate in atlanta is on the rise this year,1
says bill and hillary clinton attended donald trumps last wedding,1
the actual deportations from the interior of the country are way down under president obama,1
says scott walkers views on abortion are more restrictive than any republican president in recent times,1
in new orleans nearly 100 percent of our kids are in charter schools,1
despite what donald trump claims there werent 15000 people who turned out in phoenix to see trump speak,1
says she called for addressing risks of derivatives cracking down on subprime mortgages and improving financial oversight early on in the financial crisis,1
jasper county in texas raised property taxes by 7 percent in order to pay for one death penalty case,1
replacing 100000 old toilets with waterefficient models has saved 24 million gallons of water every day,1
greece is not a big economy its about the size of metropolitan miami,1
the house of representatives just voted 300131 to remove countryoforigin labeling on chicken pork and beef sold in the u s,1
says his release of 33 years of tax returns is more than any presidential candidate in history,1
only five states including georgia do not have a hate crimes law,1
if you want to vote in texas you can use a concealedweapon permit as a valid form of identification but a valid student id isnt good enough,1
between 1980 and 2010 water usage in georgia dropped even as the states population grew,1
46 percent of women between the age of 16 to 24 despise sexual contact in japan,1
more than half of women under 30 who give birth do so outside of marriage,1
the confederate battle flag at the south carolina statehouse must fly at a height of 30 feet any changes taken down or even at halfstaff if that can be done must be passed by a supermajority of the general assembly,1
this march for the first time in human history the monthly average carbon dioxide in our atmosphere exceeded 400 parts per million the range had been 170300 parts per million for hundreds of thousands of years,1
the top 25 hedge fund managers are making more than all of americas kindergarten teachers combined,1
ninetyseven percent of americans do not receive subsidies for health care under the affordable care act,1
georgia residents file the most insurance claims for lightning strikes in the country,1
47 percent of americans cant pay for an unexpected 400 expense through savings or credit cards without selling something or borrowing money,1
we reduced the government workforce by 13000 11 percent during my eight years,1
our reserves are now in much better shape than they were just a few years ago,1
fox news barely covered the duggar family scandal until megyn kelly was able to secure this interview,1
since 2010 eight children in georgia have died due to vehicular heatstroke,1
you can fill out your tax return in estonia online in five minutes,1
one out of five of our children live in a family thats on food stamps,1
for the first time in 35 years we have more businesses dying than we do starting,1
we spend more money on lobbying than we do on campaigns,1
a 5050 publicprivate split for paying for a new milwaukee bucks arena would be much better in terms of the portion of the public financing than most of the other arena projects done around the country,1
if you count united states airstrikes against isis 75 percent of those combat missions return to base without having fired a weapon,1
says sen rand paul rky has stated that supporting the right to health care means you believe in slavery,1
georgia ranks 49th for women serving in elected state and federal offices,1
says he was known as veto corleone for cutting spending as florida governor,1
the united states is one of only seven nations that allows elective abortions after 20 weeks postfertilization,1
accidents are down 50 percent and injury accidents are down 60 percent in the rebuilt marquette interchange in milwaukee,1
georgia is on track for 1200 traffic fatalities this year a reversal of nine years of declines,1
annual precipitation has increased in rhode island by over 12 inches in the last century,1
says mike huckabee appeared in diabetes infomercials to endorse cures and treatments that no health agency supports,1
the state budget will include scholarship money for minority students as a concession to senate democrats for supporting the gopinitiated transportation bill,1
during the bush administration you actually had a prominent liberal write a book about how bush was preparing for a fascist takeover of this country,1
an audit shows there are 65 million people who have active social security numbers who are 112 years of age or older,1
wisconsins nondiscrimination law doesnt protect members of the transgender community,1
when we moved into the white house we had the lowest net worth of any family since harry truman,1
the people of tiverton have historically supported gambling measures at a rate higher than the rest of the state,1
the iranians are now saying that what were saying the deal is and what they understand it to be are two different things,1
distracted driving such as texting behind the wheel is behind a rise in traffic deaths on georgia roadways this year,1
im the only member of the house of representatives who raised most of his campaign funds in the last election from small contributions of less than 200,1
of the 13 bill clinton speeches that fetched 500000 or more only two occurred during the years his wife was not secretary of state,1
hillary clintons state department sent three comedians to india on the make chai not war tour,1
the unemployment rate among blacks in texas is 95 far more than double white unemployment and wages have fallen for black workers in texas since 2000,1
we have an 80 percent graduation rate in high school after spending more per student than any country in the world other than liechtenstein i think or luxembourg and a couple other small countries,1
the fastestgrowing part of the pentagons budget are health care expenses,1
more than 30 cents of every state tax dollar goes to medicaid,1
we are in the sixth year of recovery and median income is below what it was at the start of the recovery,1
wisconsins attorney general and state treasurer ordered the daughter of earth day founder gaylord nelson not to discuss climate change on state time,1
you cant build a christian church in saudi arabia,1
