cleanText,new_labels_1
the mortality rate for the flu is right around that of the new coronavirus its right around 2,0
heitkamp highfives schumer after voting against 20week abortion ban,0
the american murder rate is 50 times that of any other developed nation,0
says justices of the peace in texas are being asked to choose give up your career or violate your religious beliefs and perform samesex marriages,0
says bill clinton gave nukes to north korea barack obama gave nukes to iran and hillary clinton gave uranium to russia,0
says a photo shows president ronald reagan meeting with taliban leaders in the white house,0
it will cost 50000 per enrollee in obamacare over the next 10 years,0
not one democrat called for gun control after a man shot at republican lawmakers playing softball,0
and the number one killer of teens in the united states is driving while using cell phones,0
i was able to go and buy an automatic weapon most people can go out and buy an automatic weapon,0
rhode islands unemployment insurance system is the most expensive such system in the country,0
says north carolinas replacement for hb2 orders nc cities to discriminate against lgbt people until at least 2020 and unfair bathroom bans remain,0
says the house impeachment vote was the third by democrats they tried to impeach trump for criticizing the nfl and for some other things,0
the benghazi victims were left helpless to die as hillary clinton soundly slept in her bed,0
says a federal program that collects reported sideeffects of vaccinations doesnt accept possible outcomes extending to road accidents heart attacks or suicides,0
says north carolinas average teacher salary was at the national average back when i was in public school,0
says a bill cosponsored by sen claire mccaskill would give a free pass to any illegal immigrant who brings a child to the border,0
california wildfires are being magnified made so much worse by the bad environmental laws which arent allowing massive amount of readily available water to be properly utilized it is being diverted into the pacific ocean,0
the nearly sixyear delay in approving keystone is costing americans more than 100000 jobs,0
says a video shows a gay party in italy few weeks before covid19,0
a bike a boy chained to a tree in washington state in 1914 is now a fallen soldier memorial,0
says wisconsin manufacturers commerces own 2014 survey revealed that just 15 percent of business executive respondents were in favor of righttowork legislation,0
pictures and reports of empty hospitals prove covid19 spread is fake crisis for real government planned agendas,0
epa wants to regulate the family bbq,0
says about 80 to 90 of people seeking asylum do not have a valid claim,0
under the previous administration it was 100 to fill a car american energy has delivered now its 60 thats 40 you have in your pocket that you wouldnt have,0
says u s sen sherrod brown and dayton mayor nan whaley were totally misrepresenting what took place inside of the hospital their news conference after i left for el paso was a fraud it bore no resemblance to what took place with those incredible people that i was so lucky to meet and spend time with,0
passage of a referendum on an aquarium for clearwater means no future funding for our neighborhoods,0
says awardwinning milwaukee public schools teacher megan sampson was laid off because gov scott walker cut state aid to education,0
says that as president barack obama has not gone to the texasmexico border,0
according to its website black lives matter inc is not a charity it is a fullfledged corporation that does not have any locations,0
says that in his first two years wisconsin has seen its best twoyear job growth in a decade,0
says the medicaid fraud rate in virginia was factchecked and found to be 047 percent,0
says donald trump tweeted danny devito supports baby murder,0
socialist workers party leader bernie sanders supported ayatollah khomeini against the us condemned president carter for imperialism and accused the hostages of being cia spies,0
i am the first latina to run for governor of texas,0
under new yorks new abortion law if the baby was born alive they would just let the baby expire,0
over 200 years ago the united states had declared war on islam and thomas jefferson led the charge,0
china produces 90 of the worlds carbon emissions pollution,0
says former nba player rick fox was also on board with kobe bryant,0
germany and the united states are the two best in deaths per 100000 people which frankly to me thats perhaps the most important number there is,0
the 911 terrorists friends family girlfriends in the united states were sent back for the most part to saudi arabia they knew what was going on they went home and they wanted to watch their boyfriends on television,0
a photo shows rob cantrall at a recent michigan protest,0
a photo shows two italian nurses in a hospital a few days before they got covid19 and died,0
says dallas cowboys owner jerry jones told players stand for the anthem or youre off team,0
when winston churchill was asked to cut arts funding in favour of the war effort he simply replied then what are we fighting for,0
among syrian refugees and migrants coming into europe there look like very few women very few children,0
abortions account for 94 percent of the services provided for pregnant women by planned parenthood,0
every time we raise the minimum wage the number of jobless people increases,0
obamacare raised premiums by 100 percent and after that 91 percent of the people were covered but were all paying 100 percent more,0
there is no statistical evidence that bail bonds increase the likelihood of those awaiting trial returning to court for their scheduled hearings,0
georgia gov brian kemp mandates restaurants reopen,0
the covid19 future vaccine will come with the id a mark the id tells everyone you are free of covid,0
says a video shows iranian rockets being launched toward u s airbases in iraq,0
says that ice melting in a cup illustrates that sea levels dont rise when icebergs melt,0
in 2005 dan branch tried to expand thirdtrimester abortions in texas,0
a man arrested by lubbock texas police for a gun threat said his accomplices will be going to different walmart stores and shooting,0
nazi imagery was used by the block for governor campaign to describe supporters of allan fung for governor,0
of the roughly 15 percent of americans who dont have health insurance half of them made more than 50000 a year,0
the american slave trade caused 5 million deaths or more,0
says rep ilhan omar dminn was speaking about how wonderful alqaida is,0
there have been more than 270 mass shootings in the united states in the last year alone thats where four or more are killed,0
it was rob portmans job to stop chinas illegal dumping of steel he failed looked the other way did nothing,0
says a photo from jfk airport shows our troops leaving to protect each one of us and our country,0
adolf hitler confiscated all the weapons took all the weapons had a registry of everybody and then on the night of june 30 1934 sent out his secret police and murdered all of his political opponents,0
says no i dont benefit i dont benefit from his tax proposal,0
says donald trump is going to go out and carpet bomb the middle east,0
floridas regulations on the payday lending industry are stronger than almost any other state,0
weve signed more bills and im talking about through the legislature than any president ever,0
quotes joe biden as saying no ordinary american cares about constitutional rights,0
i have had to fill out fec reports for the past six years now and theyre much more detailed than a tax return,0
as district attorney susan happ took 180000 in a shady land deal from a man charged with multiple felony counts of sexual assault before she offered him a deferred prosecution,0
the crime rate in some atlanta neighborhoods has dropped by 35 to 51 percent,0
in 2008 candidate obama hes not even presidentelect sends william miller over to iran to establish a back channel and let the iranians know that should he win the election they will have friendlier terms,0
the day al gore was born there were 130000 glaciers on earth today only 130000 remain,0
says that president barack obama said an attack on syria was going to be a pinprick,0
medicaid expansion could cost the commonwealth of virginia over 1 billion a year,0
wisconsin is 49th out of 50 states in infrastructure,0
says wearing face masks is more harmful to your health than going without one,0
says the asian hong kong swine and bird flus each killed more people than coronavirus,0
in 2007 when nancy pelosi met with president assad of syria nobody got upset,0
quotes thomas jefferson as saying that a government big enough to give you everything you want is strong enough to take everything you have,0
the insurance industry is actually run by mostly democrats,0
if donald trump would stay home from maralago one weekend it would pay the entire meals on wheels budget for the state of missouri for almost two years,0
in wisconsins school voucher program twothirds of the money in the tax vouchers went to people making more than 100000,0
many just call him lyin ted his tv ad about john kasich lie stations had to pull it off the air,0
says president obama was proposing pinprick strikes for military intervention in syria,0
the media never show crowds,0
these are real ads running in new york city calling for the removal of trash which includes white people trump supporters and christians,0
says that compared to direct sales by manufacturers consumers save avg of 500 per car sold through franchised dealer model,0
under david dewhursts leadership the texas senate passed an expansion of instate tuition and free health care to illegal immigrants,0
a witness will testify against hillary clinton,0
shows a photo of two similar wall street journal newspapers with different headlines about president donald trump and describes the editions as same paper same dates different markets what did you just learn feeling manipulated yet,0
a photo shows gov gretchen whitmer on mackinaw island today ignoring mask and social distancing rules,0
this is what bill gates and george soros want to do secretly stick you with a chip while testing you for the coronavirus the dems have a bill on the house floor ready to vote on it to require this,0
says president barack obama has not proposed one thing that would change the fact that warren buffett pays a lower tax rate than his secretary,0
on the federal minimum wage of 775 you cant even make half the poverty level,0
busted nasa accidentally destroys every climate change advocate by exposing massive truth behind antarctica,0
thomas paine wrote that the duty of a patriot is to protect his country from his government,0
says marco rubio said that felons should not have their voting rights restored but that convicted felons should be allowed to own guns after they have done their time,0
diseaseridden migrants from parts of africa with ebola are being dumped in san antonio,0
lee zeldin missed 23rds of veterans affairs hearings,0
gov charlie crist sought for and got approved the automatic restoration of felon rights for nonviolent offenders for the first time in florida history,0
the gops health bill will protect people with preexisting conditions every bit as well as obamacare did,0
in chicago covid19 actually lowered the death rate,0
california will have the highest gas tax in the nation once its 12 cent gas tax hike goes into effect,0
a lot of people are talking about the removal of a very fair prosecutor in ukraine,0
says mark kirk called for the mass arrest of 18000 african americans and was apparently fine with trumps stilltooracist call for mass deportation,0
del debra rodman opposes adoption as an alternative to abortion in event of unplanned pregnancies,0
north carolina last year was second in the nation in overdose deaths,0
says police are warning shoppers to use wipes to clean their carts over deadly risk of fentanyl residue,0
says a ballot can be emailed to wisconsin voters even a day before the election,0
scott wallace wants to tax families of five for irresponsible breeding,0
to be clear im not talking about confiscating anybodys guns,0
obama ordered cia to train isis jihadists,0
says conor lamb ran on a campaign that said very nice things about me,0
protesters broke into the white house,0
twenty percent of single adults ages 21 to 25 with no kids are not working or even in school trying to find a job,0
we were slow with the testing but very quick with the travel ban and thats been much more critical in saving lives,0
the wives of the 911 hijackers knew exactly what was happening and went back to saudi arabia two days before the attacks to watch their husbands on television flying the planes,0
says charlie crist is embroiled in a fraud case for steering taxpayer money to a de facto ponzi scheme,0
says a photo shows a gaspowered van towing a diesel generator that is charging an electric car,0
says nancy pelosi tweeted that she was disgusted with donald trump over taxes,0
says u s house candidate carlos curbelo supported ending the medicare guarantee,0
says travis countys sheriff refuses to enforce 8 usc 1373,0
akira is a 1988 movie about an apocalyptic event taking place months before tokyo 2020 olympics showing the world health organization advising japan to postpone the olympics because of a pandemic risk,0
over 214000 doctors opt out of obamacare exchanges,0
steve santarsiero wrote pas gun safety law,0
the california governor says yes to poisoning more children with mercury and aluminum in vaccines,0
we know from the social science that children do best with a mom and a dad,0
i have tremendous support from women,0
nfl will fly a black lives matter flag under the american flag at games,0
says mitch mcconnell was cured of polio when he was a child by governmentfunded care and now hes trying to take that same care away from millions of americans,0
not even house intelligence chairman adam schiffs republican colleagues were allowed into the scif during the house impeachment investigation,0
quotes thomas jefferson as saying that freedom is lost gradually from uninterested uninformed and uninvolved people,0
the usa freedom act undercuts privacy because the phone records will be in the hands of the phone companies with hundreds of people available to look at the records versus 20 or 30 people in the government,0
says there are thousands of registered voters over 110 years old in north carolina including one who is 219 years old,0
if you look at the one hydroxychloroquine survey the only bad survey they were giving it to people that were in very bad shape they were very old almost dead,0
every single democrat in the u s senate has signed up for the open borders and its a bill its called the open borders bill,0
president trump in his first year and a half has already tripled what president obama did for africanamerican employment in eight years,0
irans regime every friday declares war on us,0
coronavirus hoax fake virus pandemic fabricated to coverup global outbreak of 5g syndrome,0
as a 27 year old staff attorney for the house judiciary committee during the watergate investigation hillary rodham was fired by her supervisor lifelong democrat jerry zeifman when asked why hillary rodham was fired zeifman said in an interview because she was a liar she was an unethical dishonest lawyer she conspired to violate the constitution the rules of the house the rules of the committee and the rules of confidentiality,0
rhode islands graduated driving license has saved hundreds of lives,0
i am roughly being paid 53 a day to educate your child,0
the chairman of the party of florida who is an avid and outward supporter of marco rubio gets to appoint 30 of those delegates,0
health care premiums up 90 percent in new hampshire,0
a catch and release immigration policy is a democrat rule sherrod brown this is a democrat rule,0
says that four democrats sheila jackson lee joe biden elizabeth warren and alexandria ocasiocortez made specific suspect remarks about such topics as the constitution abortion and guns,0
protections on preexisting conditions have been there since the 1970s,0
says sen mitch mcconnells delay in seating alabama sen elect doug jones is a flagrant violation of senate policy which requires jones assume office the instant one of them wins the election,0
there were more people on welfare than working in 2013,0
says a republican bill he vetoed would have implemented a mandate to make public the names of all students parents or guardians,0
italian parliament calls for the arrest of bill gates,0
says joe biden wants to defund the police,0
ive always supported protections for our dreamers,0
the greenlight pinellas transportation plan involves a 300 tax increase,0
when the new hampshire legislature raised the gasoline tax gas prices in the state were skyrocketing,0
says an image shows a paralyzed groom being held up by his groomsmen so he could kiss his bride,0
californians pay the highest electricity bills in the nation,0
floridas unemployment is at a record low,0
we have one senator whos a yes vote but hes in the hospital and hes a yes vote so we cant do it by friday so we have the votes to pass a health care bill,0
the social security check is now or soon will be referred to as a federal benefit payment,0
queen elizabeth tests positive for covid19,0
two iraqis came here to this country were radicalized and they were the masterminds behind the bowling green massacre it didnt get covered,0
the vast majority of syrian refugees are young ablebodied men looking for work,0
homicides against blacks have tripled since floridas stand your ground law has been in existence,0
says colorado food stamp recipients can use atms to get cash to buy marijuana,0
says terry mcauliffe is the person who invented the scheme to rent out the lincoln bedroom,0
old photograph shows a group of women in kkk attire holding a sign that reads women of the democrat party,0
illegal immigrants mow the grass around the texas capitol,0
in 20 years there will be enough muslim voters in the u s to elect the president,0
says every day of a special session costs taxpayers 40000,0
a photo of obamas white house staff shows the alleged ukraine whistleblower,0
satanists have teamed up with the aclu and planned parenthood in missouri to roll back the rights of the unborn,0
ralph hall has never voted to raise the debt ceiling,0
five years ago when i took office our state was mired in debt a 24 billion debt left over by republicans,0
says a military humvee labeled covid19 quarantine team was on interstate 696 in michigan,0
right now women are able to access an abortion in the later stages of their pregnancy under certain conditions with approval of their medical doctors ive done nothing to change that,0
the green new deal would do away with commercial air travel,0
in 2018 biden lauded paul ryan for proposing cuts to social security and medicare,0
says charlie crist voted against minimum wage when he was in the senate,0
says congressional salaries have gone up 231 over the last 30 years now congress is saying they need a 4500 raise,0
say gov tony evers canceled the sales tax holiday this year,0
says richard cordrays plan would allow drug dealers to remain on our streets,0
america came along as the first country to end slavery within 150 years,0
says texas democrat lizzie pannill fletcher contradicted herself on her health care position by saying we need universal health care,0
america has more people employed as tax preparers 12 million than as police and firefighters,0
bill clinton gave north korea 5 billion and two nuclear reactors in 1994 essentially giving them nukes,0
says joe biden blackmailed ukraine with a billion in tax dollars to drop an investigation into his son and democrats want to impeach president trump for simply asking if it was true,0
the elimination of income and sales taxes in new york is equal to 9 percent of taxable income meaning that if you make 100000 a year you lose 9000,0
putin interference could give courts legal right to make hillary president,0
says of immigrant family separations at the border we had the exact same policy as the obama administration,0
says tammy baldwin was told by a whistleblower about overmedicated veterans she made deadly mistakes and three veterans died at the tomah va hospital,0
democrats pledged to force all north carolinians into a singlepayer health insurance scheme that would cost 72 billion,0
says joe bidens presidential campaign donated 20 million to bail out protesters,0
jeanne shaheen was principally involved in a plot with lois lerner and president barack obamas political appointee at the irs to lead a program of harassment against conservative nonprofit groups during the 2012 election,0
i was among the earliest to criticize the rush to war in iraq and yes even before the war ever started,0
florida hospital reports a coronavirus infestation with multiple confirmed patients,0
every single candidate president obama campaigned for lost in the midterms,0
1 out of every 4 car accidents in the u s is caused by texting and driving,0
the incandescent light bulb has no effect whatever on the planet,0
theres one study that came out of pew in 2008 that showed 14 percent of people who voted were noncitizens,0
red hen owner just issued sick threat to sarah sanders,0
the iran deal says that if any other country tries to undermine irans nuclear program we have to help them defend themselves against israel egypt saudis our own allies,0
an old image shows a drug store with a marijuana leaf sign,0
daraprim is still underpriced relative to its peers,0
hes low risk said obama before freeing isis leader al baghdadi,0
donald trumps been completely consistent about his plan for nonviolent undocumented immigrants,0
says joe biden said he never spoke to the ukrainian company and then the picture came out where he was playing golf with the company boss and hunter biden,0
videos show president donald trump saying i cant breathe,0
says the fda will now require sealed ice cream cartons in response to the blue bell ice cream licker thus driving up the cost for consumers,0
1928 was last time republicans had the white house the house and the senate,0
senate report admits clinton gifted children to human traffickers,0
nfl players taking a knee during the national anthem is against the law,0
new jobs numbers are in and wisconsin has fallen to dead last in midwest job growth,0
the most realistic estimates for jobs created by keystone xl are maybe 2000 jobs during the construction of the pipeline,0
fact nothing in obamacare forces people out of their health plans,0
says the coronavirus was engineered by scientists in a lab,0
ice has not deported or detained one white illegal immigrant,0
west virginia has more veterans per capita than any state,0
san francisco has spent 725 million this fiscal year cleaning up human waste and drug paraphernalia and there are more drug users on their public needle program than high school graduates,0
the dnc hack showed you that the clinton campaign was working to schedule primary debates against bernie sanders and the clinton campaign is continuing this ploy against donald trump,0
says a video proves pelosi was planning to rip up president donald trumps state of the union address from the start,0
if masks prevent coronavirus governors would have given them to prison inmates instead of releasing them,0
under hillary clinton state department officials were sending official thankyous to people who gave to the clinton foundation,0
jesus was an undocumented immigrant,0
the most recent survey of climate scientists said about 57 percent dont agree with the idea that 95 percent of the change in the climate is caused by co2,0
says rosie odonnell apparently committed the same offense five times five times when she broke the identical law that dinesh dsouza was prosecuted for,0
nyc man drops dead in middle of street suspected coronavirus,0
there is a precedent for not nominating someone to the u s supreme court in the middle of a presidential election,0
says hillary clinton in 2013 said i would like to see people like donald trump run for office theyre honest and cant be bought,0
says robert de niro said i preferred the time in america when the president and the village idiot were two different people,0
a ducks quack doesnt echo and nobody can figure out why,0
leaving 40 as a facebook comment can reveal if your account has been hacked,0
about half of the presidents have been governors half of them senators,0
says bernie sanders did not mention race or gender until 23 minutes into this speech announcing his 2020 presidential run,0
says gerald daugherty is endorsed by the austin americanstatesman,0
on job creation numbers in the latest startup ny report this is a significant number of overcounts in the compilation that ive looked at,0
says white vans with external locks are utilized for sex trafficking,0
public schools colleges and statefunded day care centers will be made into sanctuaries by bruce rauner signing sb 31,0
trump votes for death penalty for being gay,0
bob hall never successfully passed a bill,0
there is a group going to homes and pretending to be officials from home affairs they have documents with the letterhead department of home affairs and claim to be confirming that everyone has a valid id for the upcoming census they are robbing homes,0
our larger domestic threat is from racial supremacist groups,0
says former ukraine president petro poroshenko actively worked for secretary clinton,0
instagram users must post a note or everything youve ever posted becomes public from today,0
corona is so bad this guy died twice,0
during her tenure as county attorney in minnesota there was a 65 percent decrease in incarceration of africanamericans,0
says nancy pelosi came out in favor of ms13,0
